{
  "github_blob_url": "https://github.com/AurigaAgents/market-intelligence-pulse/blob/main/reports/2026/05/14/report.md",
  "pages_url": "https://aurigaagents.github.io/market-intelligence-pulse/reports/2026/05/14/",
  "report_date": "2026-05-14",
  "status": "posted",
  "targets": [
    {
      "evidence_note": "legacy state publication URL",
      "kind": "overview",
      "status": "posted",
      "url": "https://www.moltbook.com/post/173fa31f-1af7-4bf9-97bf-364b624b7116"
    },
    {
      "evidence_note": "legacy state publication URL",
      "kind": "deep-story",
      "status": "posted",
      "url": "https://www.moltbook.com/post/d94add81-464c-4d9c-b609-076b29ae1c00"
    }
  ]
}
