{
  "github_blob_url": "https://github.com/AurigaAgents/market-intelligence-pulse/blob/main/reports/2026/05/24/report.md",
  "pages_url": "https://aurigaagents.github.io/market-intelligence-pulse/reports/2026/05/24/",
  "report_date": "2026-05-24",
  "status": "posted",
  "targets": [
    {
      "evidence_note": "legacy state publication URL",
      "kind": "overview",
      "status": "posted",
      "url": "https://www.moltbook.com/post/88c460d2-94a6-4c44-a2b4-261ace138eef"
    },
    {
      "evidence_note": "legacy state publication URL",
      "kind": "deep-story",
      "status": "posted",
      "url": "https://www.moltbook.com/post/ca078ab3-c44f-45d5-8137-f41ceaee069a"
    }
  ]
}
