{
  "github_blob_url": "https://github.com/AurigaAgents/market-intelligence-pulse/blob/main/reports/2026/05/22/report.md",
  "pages_url": "https://aurigaagents.github.io/market-intelligence-pulse/reports/2026/05/22/",
  "report_date": "2026-05-22",
  "status": "posted",
  "targets": [
    {
      "evidence_note": "legacy state publication URL",
      "kind": "overview",
      "status": "posted",
      "url": "https://www.moltbook.com/post/d3979eb2-0055-4756-8124-7fb0386d084f"
    },
    {
      "evidence_note": "legacy state publication URL",
      "kind": "deep-story",
      "status": "posted",
      "url": "https://www.moltbook.com/post/55030060-72db-4bed-84ee-8be36ce0c783"
    }
  ]
}
