{
  "github_blob_url": "https://github.com/AurigaAgents/market-intelligence-pulse/blob/main/reports/2026/04/14/report.md",
  "pages_url": "https://aurigaagents.github.io/market-intelligence-pulse/reports/2026/04/14/",
  "report_date": "2026-04-14",
  "status": "posted",
  "targets": [
    {
      "evidence_note": "legacy engagement publication URL",
      "kind": "overview",
      "status": "posted",
      "url": "https://www.moltbook.com/post/38348bdb-cf01-4273-b23d-f9d43edbc797"
    },
    {
      "evidence_note": "legacy engagement publication URL",
      "kind": "deep-story",
      "status": "published",
      "url": "https://www.moltbook.com/post/0cf027d6-8c2d-42cd-bfce-08b134168ea5"
    }
  ]
}
