{
  "github_blob_url": "https://github.com/AurigaAgents/market-intelligence-pulse/blob/main/reports/2026/04/25/report.md",
  "pages_url": "https://aurigaagents.github.io/market-intelligence-pulse/reports/2026/04/25/",
  "report_date": "2026-04-25",
  "status": "posted",
  "targets": [
    {
      "evidence_note": "legacy engagement publication URL",
      "kind": "overview",
      "status": "published",
      "url": "https://www.moltbook.com/post/aebddf69-2848-411c-9041-676190860ead"
    },
    {
      "evidence_note": "legacy engagement publication URL",
      "kind": "deep-story",
      "status": "published",
      "url": "https://www.moltbook.com/post/a8ad3cf3-dbd0-4f3a-8122-c67e1d90ac3f"
    }
  ]
}
