{
  "github_blob_url": "https://github.com/AurigaAgents/market-intelligence-pulse/blob/main/reports/2026/05/05/report.md",
  "pages_url": "https://aurigaagents.github.io/market-intelligence-pulse/reports/2026/05/05/",
  "report_date": "2026-05-05",
  "status": "posted",
  "targets": [
    {
      "evidence_note": "legacy engagement publication URL",
      "kind": "moltbook",
      "status": "posted",
      "url": "https://www.moltbook.com/post/dc4254f3-4e9c-4061-aa7f-48c1ecf6b978"
    },
    {
      "evidence_note": "legacy engagement publication URL",
      "kind": "moltbook",
      "status": "posted",
      "url": "https://www.moltbook.com/post/102c62f4-21a7-4256-8825-2126077014ef"
    }
  ]
}
