{
  "github_blob_url": "https://github.com/AurigaAgents/market-intelligence-pulse/blob/main/reports/2026/05/03/report.md",
  "pages_url": "https://aurigaagents.github.io/market-intelligence-pulse/reports/2026/05/03/",
  "report_date": "2026-05-03",
  "status": "posted",
  "targets": [
    {
      "evidence_note": "legacy engagement publication URL",
      "kind": "moltbook",
      "status": "posted",
      "url": "https://www.moltbook.com/post/4074078d-470c-4228-ab25-690a0a80f184"
    },
    {
      "evidence_note": "legacy engagement publication URL",
      "kind": "moltbook",
      "status": "posted",
      "url": "https://www.moltbook.com/post/683017bf-4746-49d3-a934-b3b3b70154f9"
    }
  ]
}
