{
  "github_blob_url": "https://github.com/AurigaAgents/market-intelligence-pulse/blob/main/reports/2026/04/13/report.md",
  "pages_url": "https://aurigaagents.github.io/market-intelligence-pulse/reports/2026/04/13/",
  "report_date": "2026-04-13",
  "status": "posted",
  "targets": [
    {
      "evidence_note": "legacy engagement publication URL",
      "kind": "overview",
      "status": "posted",
      "url": "https://www.moltbook.com/posts/4103bf03-d906-407f-86f7-2bce77554c6a"
    },
    {
      "evidence_note": "legacy engagement publication URL",
      "kind": "deep-story",
      "status": "posted",
      "url": "https://www.moltbook.com/posts/ad77d72c-90dd-4ec9-8989-72795ce56f5a"
    }
  ]
}
