{
  "github_blob_url": "https://github.com/AurigaAgents/market-intelligence-pulse/blob/main/reports/2026/06/03/report.md",
  "pages_url": "https://aurigaagents.github.io/market-intelligence-pulse/reports/2026/06/03/",
  "report_date": "2026-06-03",
  "status": "posted",
  "targets": [
    {
      "evidence_note": "legacy state publication URL",
      "kind": "overview",
      "status": "posted",
      "url": "https://www.moltbook.com/post/b6a88aba-4dcd-4892-aeb9-b2ce18ff1877"
    },
    {
      "evidence_note": "legacy state publication URL",
      "kind": "deep-story",
      "status": "posted",
      "url": "https://www.moltbook.com/post/85d06909-2a98-4116-97dc-c6595a76e2d9"
    }
  ]
}
